{
  "metadata": {
    "interchange_id": "6245F015-9A24-459E-B457-5B7BA33B57B3",
    "time_stamp": "2021-01-20T12:58:03.5957639+01:00",
    "correlation_id": "6245F015-9A24-459E-B457-5B7BA33B57B3",
    "source": "urn:com:cttexpress:interchange:source:signaturit",
    "data_type": "schema/json/corpserv/corpserv-cdc-digital-signature-document-flow-events-v1.json"
  },
  "document": {
    "created_at": "2021-01-20T12:46:43+0000",
    "file": {
      "name": "LoremIpsum1.pdf",
      "pages": 1,
      "size": 57844
    },
    "id": "7e867358-3874-4321-9459-5e8aafdf6eb9",
    "events": [
      {
        "created_at": "2021-01-20T12:46:46+0000",
        "type": "email_processed"
      },
      {
        "created_at": "2021-01-20T12:46:49+0000",
        "type": "email_delivered"
      },
      {
        "created_at": "2021-01-20T12:57:26+0000",
        "type": "document_opened"
      },
      {
        "created_at": "2021-01-20T12:58:37+0000",
        "type": "terms_and_conditions_accepted"
      },
      {
        "created_at": "2021-01-20T12:58:37+0000",
        "type": "document_signed"
      },
      {
        "created_at": "2021-01-20T12:58:41+0000",
        "type": "document_completed"
      }
    ],
    "data": {
      "text_1": "12345678A",
      "text_2": "Iv√°n J Fontalvo Olivares"
    },
    "signature": {
      "id": "63fcfb72-af54-4d3c-8540-08c8a9b851b3"
    },
    "email": "ivan.fontalvo@cttexpress.com",
    "name": "Ivan Fontalvo Olivares",
    "status": "completed"
  },
  "created_at": "2021-01-20T12:58:45+0000",
  "type": "audit_trail_completed"
}